<?xml version="1.0" encoding="UTF-8"?>
<containmentSetInfo xmlns="http://www.bupt.edu.cn/xml-namespace/UMLModelOutput" xmlns:xsi="http://www.w3.org/2001/XMLSchema-instance" xsi:schemaLocation="http://www.bupt.edu.cn/xml-namespace/UMLModelOutput
D:\Backup\UMLanalyser\UMLModelOutpu.xsd">
	<classSet>
		<class>
			<className>Class</className>
			<attributeSet>
				<item>
					<name>classID</name>
					<type>integer</type>
				</item>
				<item>
					<name>teacherList</name>
					<type>DNSetType</type>
				</item>
			</attributeSet>
			<operationSet>
			</operationSet>
		</class>
		<class>
			<className>ManagedObject</className>
			<attributeSet>
				<item>
					<name>objectClass</name>
					<type>string</type>
				</item>
				<item>
					<name>objectInstance</name>
					<type>DNType</type>
				</item>
			</attributeSet>
			<operationSet>
			</operationSet>
		</class>
		<class>
			<className>Person</className>
			<attributeSet>
				<item>
					<name>birthday</name>
					<type>string</type>
				</item>
				<item>
					<name>friendList</name>
					<type>DNSetType</type>
				</item>
				<item>
					<name>personID</name>
					<type>integer</type>
				</item>
				<item>
					<name>personName</name>
					<type>string</type>
				</item>
			</attributeSet>
			<operationSet>
				<operation>
					<name>changeName</name>
					<returnType>string</returnType>
					<parameterList>
						<item>
							<name>para2</name>
							<type>string</type>
						</item>
						<item>
							<name>para1</name>
							<type>string</type>
						</item>
					</parameterList>
				</operation>
				<operation>
					<name>getID</name>
					<returnType>int</returnType>
					<parameterList>
						<item>
							<name>para1</name>
							<type>string</type>
						</item>
					</parameterList>
				</operation>
			</operationSet>
		</class>
		<class>
			<className>School</className>
			<attributeSet>
				<item>
					<name>location</name>
					<type>string</type>
				</item>
				<item>
					<name>schoolID</name>
					<type>integer</type>
				</item>
				<item>
					<name>schoolName</name>
					<type>string</type>
				</item>
				<item>
					<name>studentLimit</name>
					<type>integer</type>
				</item>
			</attributeSet>
			<operationSet>
				<operation>
					<name>setStudentLimit</name>
					<returnType>integer</returnType>
					<parameterList>
						<item>
							<name>para2</name>
							<type>integer</type>
						</item>
						<item>
							<name>para1</name>
							<type>integer</type>
						</item>
					</parameterList>
				</operation>
			</operationSet>
		</class>
		<class>
			<className>Student</className>
			<attributeSet>
				<item>
					<name>sex</name>
					<type>string</type>
				</item>
				<item>
					<name>studentNo</name>
					<type>integer</type>
				</item>
			</attributeSet>
			<operationSet>
				<operation>
					<name>changeClass</name>
					<returnType>integer</returnType>
					<parameterList>
						<item>
							<name>para2</name>
							<type>integer</type>
						</item>
						<item>
							<name>para1</name>
							<type>integer</type>
						</item>
					</parameterList>
				</operation>
				<operation>
					<name>changeSchool</name>
					<returnType>integer</returnType>
					<parameterList>
						<item>
							<name>para2</name>
							<type>integer</type>
						</item>
						<item>
							<name>para1</name>
							<type>integer</type>
						</item>
					</parameterList>
				</operation>
			</operationSet>
		</class>
		<class>
			<className>Teacher</className>
			<attributeSet>
				<item>
					<name>classList</name>
					<type>DNSetType</type>
				</item>
				<item>
					<name>phoneNo</name>
					<type>integer</type>
				</item>
				<item>
					<name>position</name>
					<type>string</type>
				</item>
				<item>
					<name>salary</name>
					<type>integer</type>
				</item>
				<item>
					<name>teacherID</name>
					<type>integer</type>
				</item>
			</attributeSet>
			<operationSet>
				<operation>
					<name>changePosition</name>
					<returnType>bool</returnType>
					<parameterList>
						<item>
							<name>para2</name>
							<type>string</type>
						</item>
						<item>
							<name>para1</name>
							<type>integer</type>
						</item>
					</parameterList>
				</operation>
				<operation>
					<name>setSalary</name>
					<returnType>bool</returnType>
					<parameterList>
						<item>
							<name>para2</name>
							<type>integer</type>
						</item>
						<item>
							<name>para1</name>
							<type>integer</type>
						</item>
					</parameterList>
				</operation>
			</operationSet>
		</class>
	</classSet>
	<relationshipSet>
		<associationList>
			<associationInfo>
				<associationRelationshipName>NULL</associationRelationshipName>
				<associationDirection>unidirectional</associationDirection>
				<fromClass>Class</fromClass>
				<fromAssociationAttribute>teacherList</fromAssociationAttribute>
				<fromMultiplicity>1..*</fromMultiplicity>
				<toClass>Teacher</toClass>
				<toAssociationAttribute>classList</toAssociationAttribute>
				<toMultiplicity>0..*</toMultiplicity>
			</associationInfo>
			<associationInfo>
				<associationRelationshipName>NULL</associationRelationshipName>
				<associationDirection>unidirectional</associationDirection>
				<fromClass>Person</fromClass>
				<fromAssociationAttribute>NULL</fromAssociationAttribute>
				<fromMultiplicity>0..*</fromMultiplicity>
				<toClass>Person</toClass>
				<toAssociationAttribute>FriendList</toAssociationAttribute>
				<toMultiplicity>0..*</toMultiplicity>
			</associationInfo>
		</associationList>
		<aggregationList>
			<containmentInfo>
				<containmentRelationshipName>NULL</containmentRelationshipName>
				<superiorClass>Class</superiorClass>
				<superiorClassMultiplicity>1</superiorClassMultiplicity>
				<subordinateClass>Student</subordinateClass>
				<subordinateClassMultiplicity>1..*</subordinateClassMultiplicity>
			</containmentInfo>
			<containmentInfo>
				<containmentRelationshipName>NULL</containmentRelationshipName>
				<superiorClass>School</superiorClass>
				<superiorClassMultiplicity>1</superiorClassMultiplicity>
				<subordinateClass>Teacher</subordinateClass>
				<subordinateClassMultiplicity>1..*</subordinateClassMultiplicity>
			</containmentInfo>
		</aggregationList>
		<compositionList>
			<containmentInfo>
				<containmentRelationshipName>NULL</containmentRelationshipName>
				<superiorClass>School</superiorClass>
				<superiorClassMultiplicity>1</superiorClassMultiplicity>
				<subordinateClass>Class</subordinateClass>
				<subordinateClassMultiplicity>1..*</subordinateClassMultiplicity>
			</containmentInfo>
		</compositionList>
		<generalizationList>
			<generalizationInfo>
				<parentClass>ManagedObject</parentClass>
				<childClass>Class</childClass>
			</generalizationInfo>
			<generalizationInfo>
				<parentClass>ManagedObject</parentClass>
				<childClass>School</childClass>
			</generalizationInfo>
			<generalizationInfo>
				<parentClass>ManagedObject</parentClass>
				<childClass>Person</childClass>
			</generalizationInfo>
			<generalizationInfo>
				<parentClass>Person</parentClass>
				<childClass>Student</childClass>
			</generalizationInfo>
			<generalizationInfo>
				<parentClass>Person</parentClass>
				<childClass>Teacher</childClass>
			</generalizationInfo>
		</generalizationList>
	</relationshipSet>
</containmentSetInfo>
